{
  "$schema": "http://json-schema.org/draft-07/schema#",
  "title": "Contestant execution metadata",
  "type": "object",
  "required": ["harness", "models", "context", "subagents", "prompts", "workspace", "status"],
  "properties": {
    "harness": {
      "type": "object",
      "required": ["harness"],
      "properties": {
        "harness": { "enum": ["codex", "opencode", "unknown"] },
        "version": { "type": ["string", "null"] },
        "cli_version": { "type": ["string", "null"] },
        "originator": { "type": ["string", "null"] },
        "source": { "type": ["string", "null"] },
        "thread_source": { "type": ["string", "null"] },
        "multi_agent_version": { "type": ["string", "null"] },
        "history_mode": { "type": ["string", "null"] },
        "memory_mode": { "type": ["string", "null"] },
        "model_provider": { "type": ["string", "null"] },
        "codex_runtime_version": { "type": ["string", "null"] },
        "config_dir": { "type": ["string", "null"] },
        "config_entries": { "type": ["array", "null"], "items": { "type": "string" } },
        "plugins": { "type": "array", "items": { "type": "object" } }
      }
    },
    "models": { "type": "object" },
    "context": { "type": "object" },
    "threads": { "type": "object" },
    "subagents": { "type": "array", "items": { "type": "object" } },
    "opencodex": { "type": ["object", "null"] },
    "opencode": {
      "type": ["object", "null"],
      "properties": {
        "sessions": {
          "type": "array",
          "items": {
            "type": "object",
            "properties": {
              "tokens_input": { "type": "integer", "minimum": 0 },
              "tokens_output": { "type": "integer", "minimum": 0 },
              "tokens_reasoning": { "type": "integer", "minimum": 0 },
              "tokens_cache_read": { "type": "integer", "minimum": 0 },
              "tokens_cache_write": { "type": "integer", "minimum": 0 },
              "cost": { "type": "number", "minimum": 0 }
            }
          }
        },
        "root_session_count": { "type": "integer" },
        "subagent_session_count": { "type": "integer" },
        "activity_time_seconds": { "type": "number" },
        "idle_time_seconds": { "type": "number" },
        "idle_gap_threshold_seconds": { "type": "integer" }
      }
    },
    "prompts": { "type": "object" },
    "workspace": { "type": "object" },
    "session_window": {
      "type": ["object", "null"],
      "properties": {
        "started_at": { "type": ["string", "null"] },
        "ended_at": { "type": ["string", "null"] },
        "activity_time_seconds": { "type": "number" },
        "idle_time_seconds": { "type": "number" },
        "idle_gap_threshold_seconds": { "type": "integer" }
      }
    },
    "questions": {
      "type": "array",
      "items": {
        "type": "object",
        "required": ["id", "question", "reason", "suggested_source", "answer"],
        "properties": {
          "id": { "type": "string" },
          "question": { "type": "string" },
          "reason": { "type": "string" },
          "suggested_source": { "type": "string" },
          "answer": { "type": ["string", "null"] }
        }
      }
    },
    "user_answers": { "type": "object" },
    "status": { "enum": ["complete", "needs_user_input"] },
    "provenance": { "type": "object" }
  }
}
