{
  "harness": {
    "harness": "codex",
    "cli_version": "0.146.0",
    "originator": "codex-tui",
    "source": "cli",
    "thread_source": "user",
    "multi_agent_version": "v2",
    "history_mode": "legacy",
    "memory_mode": "disabled",
    "model_provider": "openai",
    "codex_runtime_version": null,
    "plugins": []
  },
  "models": {
    "BLSC/GLM-5.2": {
      "catalog": {
        "display_name": null,
        "context_window": 522500,
        "max_context_window": null,
        "supported_reasoning_levels": null
      },
      "reasoning_efforts_seen": [
        "max"
      ],
      "max_context_used": 267608,
      "threads": 1
    }
  },
  "context": {
    "by_model": {
      "BLSC/GLM-5.2": {
        "context_window": 522500,
        "max_context_used": 267608
      }
    },
    "by_thread": {
      "019fbef6-8a0e-71f0-8642-db5302a41979": {
        "model": "BLSC/GLM-5.2",
        "max_input_tokens": 267608,
        "mean_input_tokens": 173180.7,
        "model_context_window_recorded": 522500
      }
    },
    "notes": []
  },
  "threads": {
    "019fbef6-8a0e-71f0-8642-db5302a41979": {
      "thread_id": "019fbef6-8a0e-71f0-8642-db5302a41979",
      "is_subagent": false,
      "model": "BLSC/GLM-5.2",
      "entry_model": "BLSC/GLM-5.2",
      "model_provider": "openai",
      "reasoning_effort": [
        "max"
      ],
      "entry_reasoning_effort": "max",
      "tokens_used": 40557801,
      "cwd": "/mnt/ssd-SATARAID5/harry/projects/cfd_agentic_benchmark/cfd_solver_benchmark_workspace_template/workspace/codex/glm52-m3/01",
      "git_branch": "codex/glm52-m3/init",
      "created_at": 1785615256,
      "updated_at": 1785620217,
      "started_at": "2026-08-01T20:14:30.524000+00:00",
      "ended_at": "2026-08-01T21:36:57.469000+00:00",
      "context_used_max_input": 267608,
      "context_used_mean_input": 173180.7,
      "model_context_window_recorded": 522500
    }
  },
  "subagents": [],
  "opencodex": {
    "trigger": "non_vanilla_models",
    "non_vanilla_models": [
      "BLSC/GLM-5.2"
    ],
    "opencodex_version": "opencodex 2.14.0",
    "opencodex_submodule_pin": null,
    "config_facts": {},
    "codex_proxy_fallback_config": "/home/harry/.codex/opencodex.config.toml"
  },
  "prompts": {
    "by_root_thread": {
      "019fbef6-8a0e-71f0-8642-db5302a41979": {
        "goal_objective": "complete the work defined cfd_solver_agentic_benchmark/.",
        "goal_status": "complete",
        "initial_user_prompt": {
          "timestamp": "2026-08-01T20:25:27.810Z",
          "text": "<user_shell_command>\n<command>\nsleep 9m\n</command>\n<result>\nExit code: -1\nDuration: 0.0000 seconds\nOutput:\ncommand aborted by user\n</result>\n</user_shell_command>"
        },
        "resume_prompts": [],
        "source": "session_rollout"
      }
    }
  },
  "workspace": {
    "git": {
      "branch": "codex/glm52-m3/01",
      "commit": "6b3765641f72df4042c151a3894389540f1d28f4"
    },
    "agents_md": {
      "path": "/mnt/ssd-SATARAID5/harry/projects/cfd_agentic_benchmark/cfd_solver_benchmark_workspace_template/workspace/codex/glm52-m3/01/AGENTS.md",
      "exists": true,
      "sha256": "849d35819a6b19178c8b6752d81761585a9cf9792fedf1ee1f4c6c34c48c6633",
      "content": "# AGENTS.md\n\nProject instructions for coding agents working in this repository.\n\n## 1. Git Discipline\n\n- Do NOT run `git pull`, `git push`, or switch branches without explicit user\n  authorization. Unauthorized remote or branch mutations are prohibited.\n- Do use `git commit` (and `git stash` when needed) freely as code checkpoints:\n  commit or stash working progress regularly so partial work can be resumed or\n  rolled back. Local checkpoint commits do not require approval; only pushing\n  and branch/remote mutations require it.\n\n## 2. Subagents\n\n- Delegating independent subtasks to subagents is encouraged.\n- Subagent model policy: the allowed subagent models are `BLSC/GLM-5.2` and\n  `BLSC/MiniMax-M3` (passed as the `model` override to `spawn_agent`).\n  Do not spawn subagents with any other model.\n- Visual handoff (important): whenever a subagent produces something visual \u2014\n  a report, plot, figure, or postprocessing output \u2014 hand it off to a\n  `BLSC/MiniMax-M3` subagent for visual checks and design review before the\n  task is considered done.\n\n## 3. Persistence\n\n- Once the user has started a task, do not stop until the specified task is\n  accomplished to a level of satisfaction: completed results, validated\n  artifacts, and an honest report. Work through blockers with safe in-scope\n  checks and alternatives; only stop early when genuinely blocked or explicitly\n  told to stop.\n",
      "matches_git_head": true
    },
    "codegraph": {
      "exists": true,
      "path": "/mnt/ssd-SATARAID5/harry/projects/cfd_agentic_benchmark/cfd_solver_benchmark_workspace_template/workspace/codex/glm52-m3/01/.codegraph"
    },
    "benchmark_submodule": {
      "path": "/mnt/ssd-SATARAID5/harry/projects/cfd_agentic_benchmark/cfd_solver_benchmark_workspace_template/workspace/codex/glm52-m3/01/cfd_solver_agentic_benchmark",
      "exists": true,
      "commit": "1bc6580b84825037bbeac097ede1b2226d8185d1",
      "branch": "HEAD",
      "dirty": false,
      "origin_url": "https://github.com/harryzhou2000/cfd_solver_agentic_benchmark"
    }
  },
  "session_window": {
    "started_at": "2026-08-01T20:14:30.524000+00:00",
    "ended_at": "2026-08-01T21:36:57.469000+00:00"
  },
  "provenance": {
    "state_db": "workspace/codex/glm52-m3/01/.sessions/codex/state_5.sqlite",
    "goals_db": "workspace/codex/glm52-m3/01/.sessions/codex/goals_1.sqlite",
    "logs_db": "workspace/codex/glm52-m3/01/.sessions/codex/logs_2.sqlite",
    "sessions_root": "workspace/codex/glm52-m3/01/.sessions/codex/sessions",
    "history": "/tmp/no-history",
    "ocx_config": "/tmp/no-ocx-config",
    "ocx_catalog": "/tmp/no-ocx-catalog",
    "plugins_root": "/tmp/no-plugins",
    "generated_at": "2026-08-13T15:19:16.646859+00:00",
    "num_threads": 1
  },
  "questions": [],
  "user_answers": {},
  "status": "complete"
}
