{
  "harness": {
    "harness": "opencode",
    "version": "1.18.11",
    "config_dir": "/mnt/ssd-SATARAID5/harry/projects/cfd_agentic_benchmark/cfd_solver_benchmark_workspace_template/workspace/omo-slim/dsv4/02/.sessions/opencode-config",
    "config_entries": null,
    "model_provider": null
  },
  "models": {
    "deepseek-v4-pro@max": {
      "model": "deepseek-v4-pro",
      "variant": "max",
      "provider": "deepseek",
      "catalog": {
        "display_name": null,
        "context_window": null
      },
      "reasoning_efforts_seen": [
        "max"
      ],
      "max_context_used": 19707738,
      "threads": 1,
      "tokens_input": 19707738,
      "tokens_output": 67379,
      "tokens_reasoning": 21283,
      "cost": 8.655204801999998
    }
  },
  "context": {
    "by_model": {
      "deepseek-v4-pro@max": {
        "context_window": null,
        "max_context_used": 19707738
      }
    },
    "by_session": {
      "ses_03e6cdbcaffefVyMLw9N6OIQGR": {
        "model": "deepseek-v4-pro",
        "variant": "max",
        "max_input_tokens": 19707738
      }
    },
    "notes": []
  },
  "subagents": [],
  "opencodex": null,
  "opencode": {
    "sessions": [
      {
        "session_id": "ses_03e6cdbcaffefVyMLw9N6OIQGR",
        "parent_id": null,
        "title": "CFD solver agentic benchmark task",
        "agent": "orchestrator",
        "model": "deepseek-v4-pro",
        "provider": "deepseek",
        "variant": "max",
        "tokens_input": 19707738,
        "tokens_output": 67379,
        "tokens_reasoning": 21283,
        "cost": 8.655204801999998,
        "time_created": 1785659073589,
        "time_updated": 1785665914601,
        "started_at": "2026-08-02T08:24:33.589000+00:00",
        "ended_at": "2026-08-02T10:18:34.601000+00:00",
        "activity": {
          "activity_time_seconds": 4141.8,
          "wall_time_seconds": 6840.7,
          "idle_time_seconds": 2698.9,
          "idle_gaps": 1,
          "idle_gap_threshold_seconds": 600,
          "events": 301
        }
      }
    ],
    "root_session_count": 1,
    "subagent_session_count": 0,
    "activity_time_seconds": 4141.8,
    "idle_time_seconds": 2698.9,
    "idle_gap_threshold_seconds": 600
  },
  "prompts": {
    "by_root_session": {
      "ses_03e6cdbcaffefVyMLw9N6OIQGR": {
        "initial_user_prompt": {
          "timestamp": "2026-08-02T08:24:33.667000+00:00",
          "text": "OpenCode goal mode command \"/goal\" was invoked.\n\nArguments:\n<goal_command_arguments>\ncomplete the task defined in @cfd_solver_agentic_benchmark/ .\n</goal_command_arguments>\n\nUse the goal tools to handle this command:\n\n- If the arguments are empty, call get_goal and briefly report the current goal state.\n- If the arguments are \"status\", \"show\", or \"current\", call get_goal and briefly report the current goal state.\n- If the arguments are \"history\", call get_goal_history and briefly report the current goal history.\n- If the arguments are \"clear\", \"stop\", \"off\", \"reset\", \"none\", or \"cancel\", call clear_goal and report whether a goal was cleared.\n- If the arguments are \"pause\", pause the current goal by calling update_goal_status with status \"paused\" and report the result.\n- If the arguments are \"resume\", resume the current goal by calling update_goal_status with status \"active\" and continue working toward it.\n- If the arguments start with \"edit \", update the current goal objective by calling update_goal_objective with the remaining text.\n- If the arguments start with \"complete \" or \"done \", perform a completion audit against real artifacts and command output. Call update_goal with status \"complete\" only if the goal is achieved, using concise evidence from the audit.\n- If the arguments start with \"unmet \", \"blocked \", or \"blocker \", call update_goal with status \"unmet\" only when the goal cannot be achieved or needs external input, using the remaining arguments as the blocker.\n- Otherwise, create a new goal with create_goal. Use the full arguments as the objective. If the user includes explicit budget instructions, pass token_budget, max_auto_turns, or max_duration_seconds to create_goal rather than leaving those words in the objective.\n\nCreate a goal only from these explicit command arguments. Do not infer a goal from unrelated session context. After create_goal succeeds, continue working toward the new goal.Called the Read tool with the following input: {\"filePath\":\"/mn"
        },
        "resume_prompts": []
      }
    }
  },
  "workspace": {
    "git": {
      "branch": "omo_slim/dsv4/02",
      "commit": "e272cd3f195e4d7cf490acd9be3578c7893056e0"
    },
    "agents_md": {
      "path": "/mnt/ssd-SATARAID5/harry/projects/cfd_agentic_benchmark/cfd_solver_benchmark_workspace_template/workspace/omo-slim/dsv4/02/AGENTS.md",
      "exists": true,
      "sha256": "618f5e01541904c3b16a1b9ee653b633c349b527731c92b988c51dd3f5b20f77",
      "content": "# AGENTS.md\n\nProject instructions for coding agents working in this repository.\n\n## 1. Git Discipline\n\n- Do NOT run `git pull`, `git push`, or switch branches without explicit user\n  authorization. Unauthorized remote or branch mutations are prohibited.\n- Do use `git commit` (and `git stash` when needed) freely as code checkpoints:\n  commit or stash working progress regularly so partial work can be resumed or\n  rolled back. Local checkpoint commits do not require approval; only pushing\n  and branch/remote mutations require it.\n\n## 2. Subagents\n\n- Delegating independent subtasks to subagents is encouraged.\n- There is NO subagent model policy on this branch: subagents may use any\n  available model. No model is required, restricted, or pinned.\n\n## 3. Persistence\n\n- Once the user has started a task, do not stop until the specified task is\n  accomplished to a level of satisfaction: completed results, validated\n  artifacts, and an honest report. Work through blockers with safe in-scope\n  checks and alternatives; only stop early when genuinely blocked or explicitly\n  told to stop.\n",
      "matches_git_head": true
    },
    "codegraph": {
      "exists": true,
      "path": "/mnt/ssd-SATARAID5/harry/projects/cfd_agentic_benchmark/cfd_solver_benchmark_workspace_template/workspace/omo-slim/dsv4/02/.codegraph"
    },
    "benchmark_submodule": {
      "path": "/mnt/ssd-SATARAID5/harry/projects/cfd_agentic_benchmark/cfd_solver_benchmark_workspace_template/workspace/omo-slim/dsv4/02/cfd_solver_agentic_benchmark",
      "exists": true,
      "commit": "1bc6580b84825037bbeac097ede1b2226d8185d1",
      "branch": "HEAD",
      "dirty": false,
      "origin_url": "https://github.com/harryzhou2000/cfd_solver_agentic_benchmark"
    }
  },
  "session_window": {
    "started_at": "2026-08-02T08:24:33.589000+00:00",
    "ended_at": "2026-08-02T10:18:34.601000+00:00",
    "activity_time_seconds": 4141.8,
    "idle_time_seconds": 2698.9,
    "idle_gap_threshold_seconds": 600
  },
  "questions": [
    {
      "id": "context_window_deepseek-v4-pro@max",
      "question": "What is the context window (max tokens) of model `deepseek-v4-pro`?",
      "reason": "model is not listed in the local model catalog",
      "suggested_source": "provider docs or model card",
      "answer": "Unavailable in bundled immutable telemetry; no local model catalog entry is present and no home, provider, or internet source was queried."
    }
  ],
  "user_answers": {
    "context_window_deepseek-v4-pro@max": "Unavailable in bundled immutable telemetry; no local model catalog entry is present and no home, provider, or internet source was queried."
  },
  "status": "complete",
  "provenance": {
    "opencode_db": "/mnt/ssd-SATARAID5/harry/projects/cfd_agentic_benchmark/cfd_solver_benchmark_workspace_template/workspace/omo-slim/dsv4/02/.sessions/opencode-data/opencode/opencode.db",
    "opencode_config_dir": "/mnt/ssd-SATARAID5/harry/projects/cfd_agentic_benchmark/cfd_solver_benchmark_workspace_template/workspace/omo-slim/dsv4/02/.sessions/opencode-config",
    "generated_at": "2026-08-14T08:17:56.643980+00:00",
    "num_sessions": 1
  }
}
