{
  "harness": {
    "harness": "opencode",
    "version": "1.18.14",
    "config_dir": "/mnt/ssd-SATARAID5/harry/projects/cfd_agentic_benchmark/cfd_solver_benchmark_workspace_template/workspace/oc-goal/kimik3-dsv4/04/.sessions/opencode-config",
    "config_entries": [
      ".gitignore",
      ".oh-my-opencode-slim",
      "agents",
      "commands",
      "cost-guard.config.jsonc",
      "mcp",
      "node_modules",
      "oh-my-opencode-slim.json",
      "opencode.jsonc",
      "opencode.jsonc.aux",
      "opencode.jsonc.bkp",
      "package-lock.json",
      "package.json",
      "rate-limit-retry-debug.log",
      "rules",
      "skills",
      "themes",
      "tui.json",
      "tui.jsonc"
    ],
    "model_provider": null
  },
  "models": {
    "deepseek-v4-pro@max": {
      "model": "deepseek-v4-pro",
      "variant": "max",
      "provider": "deepseek",
      "catalog": {
        "display_name": "BLSC/DeepSeek-V4-Pro",
        "context_window": 550000
      },
      "reasoning_efforts_seen": [
        "max"
      ],
      "max_context_used": 807023,
      "threads": 1,
      "tokens_input": 807023,
      "tokens_output": 222968,
      "tokens_reasoning": 501,
      "tokens_cache_read": 88887757,
      "tokens_cache_write": 0,
      "cost": 0.17045796900000001
    }
  },
  "context": {
    "by_model": {
      "deepseek-v4-pro@max": {
        "context_window": 550000,
        "max_context_used": 807023
      }
    },
    "by_session": {
      "ses_004294f0cffe1r1FQyzhLt47Ym": {
        "model": "deepseek-v4-pro",
        "variant": "max",
        "max_input_tokens": 807023
      }
    },
    "notes": []
  },
  "subagents": [],
  "opencodex": null,
  "opencode": {
    "sessions": [
      {
        "session_id": "ses_004294f0cffe1r1FQyzhLt47Ym",
        "parent_id": null,
        "directory": "/workspace",
        "title": "CFD solver agentic benchmark task",
        "agent": "orchestrator",
        "model": "deepseek-v4-pro",
        "provider": "deepseek",
        "variant": "max",
        "tokens_input": 807023,
        "tokens_output": 222968,
        "tokens_reasoning": 501,
        "tokens_cache_read": 88887757,
        "tokens_cache_write": 0,
        "cost": 0.17045796900000001,
        "time_created": 1786636579059,
        "time_updated": 1786663362395,
        "started_at": "2026-08-13T15:56:19.059000+00:00",
        "ended_at": "2026-08-13T23:22:42.395000+00:00",
        "original_parent_id": null,
        "activity": {
          "activity_time_seconds": 23352.2,
          "wall_time_seconds": 26782.5,
          "idle_time_seconds": 3430.3,
          "idle_gaps": 5,
          "idle_gap_threshold_seconds": 600,
          "events": 698
        }
      }
    ],
    "root_session_count": 1,
    "subagent_session_count": 0,
    "activity_time_seconds": 23352.2,
    "idle_time_seconds": 3430.3,
    "idle_gap_threshold_seconds": 600
  },
  "prompts": {
    "by_root_session": {
      "ses_004294f0cffe1r1FQyzhLt47Ym": {
        "initial_user_prompt": {
          "timestamp": "2026-08-13T15:56:19.287000+00:00",
          "text": "New active goal: Complete the task defined in @cfd_solver_agentic_benchmark/ .\n\nStart working toward this goal now.\nWhen the goal is fully satisfied, summarize your evidence on a line starting with `[goal:evidence]`, then end your response with `[goal:complete]`. A `[goal:complete]` without a `[goal:evidence]` line is rejected and not recorded.\nIf you are truly blocked and need the user, state the concrete blocker on the line immediately before `[goal:blocked]`.\nUse `/goal history` to inspect recent lifecycle events and checkpoints.\n\nLimits: 100000 auto-continues, 2592000s, 100,000,000,000 context tokens.Called the Read tool with the following input: {\"filePath\":\"/workspace/cfd_solver_agentic_benchmark\"}<path>/workspace/cfd_solver_agentic_benchmark</path>\n<type>directory</type>\n<entries>\n.git\n.gitignore\n.ignore\nCASES_REFERENCE.md\nexaminer/\nGETTING_STARTED.md\nINPUT_FORMAT.md\ninputs/\nNUMERICAL_PARAMETERS.md\nOUTPUT_CONTRACT.md\nREADME.md\nreport_requirements.tex\nresults_template/\nTASK.md\n\n(14 entries)\n</entries>Called the Read tool with the following input: {\"filePath\":\"/workspace/cfd_solver_agentic_benchmark/\"}<path>/workspace/cfd_solver_agentic_benchmark/</path>\n<type>directory</type>\n<entries>\n.git\n.gitignore\n.ignore\nCASES_REFERENCE.md\nexaminer/\nGETTING_STARTED.md\nINPUT_FORMAT.md\ninputs/\nNUMERICAL_PARAMETERS.md\nOUTPUT_CONTRACT.md\nREADME.md\nreport_requirements.tex\nresults_template/\nTASK.md\n\n(14 entries)\n</entries>"
        },
        "resume_prompts": [
          {
            "timestamp": "2026-08-13T23:21:53.960000+00:00",
            "text": "<goal_continuation>\n<progress_budget>\nturns_remaining: 99999\ntokens_remaining: 99999616799\nelapsed_seconds: 26735\n</progress_budget>\nContinue the next concrete step; inspect and repair failures.\nCompletion format\u2014consecutive plain lines; no Markdown/backticks/blank line:\n[goal:evidence] <proof>\n[goal:complete]\nNeed user input? State why before [goal:blocked].\n<evidence_required>\nPrevious completion was rejected: evidence was missing. Verify first, then put `[goal:evidence] \u2026` immediately before `[goal:complete]`.\n</evidence_required>\n</goal_continuation>"
          }
        ]
      }
    }
  },
  "workspace": {
    "git": {
      "branch": "oc-goal/kimik3-dsv4/04",
      "commit": "f45bb5967a6ffb5419140eeb6b10ef3d9090f9ae"
    },
    "agents_md": {
      "path": "/mnt/ssd-SATARAID5/harry/projects/cfd_agentic_benchmark/cfd_solver_benchmark_workspace_template/workspace/oc-goal/kimik3-dsv4/04/AGENTS.md",
      "exists": true,
      "sha256": "6f67a229e3d8e607d76d4b9f7d2f3a085c9d9bfc4d8373481ee98784c340b69e",
      "content": "# AGENTS.md\n\nProject instructions for coding agents working in this repository.\n\n## Sandbox (read/write restriction)\n\n- The agent is FORBIDDEN from reading or writing any directory other than the\n  current working directory (cwd). This includes `/tmp` and the parent\n  directory. All file reads and writes must stay inside the workspace.\n\n## 1. Git Discipline\n\n- Do NOT run `git pull`, `git push`, or switch branches without explicit user\n  authorization. Unauthorized remote or branch mutations are prohibited.\n- Do use `git commit` (and `git stash` when needed) freely as code checkpoints:\n  commit or stash working progress regularly so partial work can be resumed or\n  rolled back. Local checkpoint commits do not require approval; only pushing\n  and branch/remote mutations require it.\n\n## 2. Subagents\n\n- Delegating independent subtasks to subagents is encouraged.\n- Dispatch subagents with the `task` tool (normal dispatch) or the same\n  `task` tool with `background: true` (experimental background subagents;\n  requires `OPENCODE_EXPERIMENTAL_BACKGROUND_SUBAGENTS=true`); either form\n  may be used. `subagent_type` selects the agent, `prompt`/`description`\n  carry the task, and `task_id` resumes an earlier subagent session.\n- Subagent model policy: the ONLY allowed subagent model is\n  `deepseek/deepseek-v4-flash` (the deepseek-provided model id reported by\n  `opencode models`, configured on the subagent agent type used with the\n  `task` tool). Do not dispatch subagents with any other model.\n\n## 3. Persistence\n\n- Once the user has started a task, do not stop until the specified task is\n  accomplished to a level of satisfaction: completed results, validated\n  artifacts, and an honest report. Work through blockers with safe in-scope\n  checks and alternatives; only stop early when genuinely blocked or explicitly\n  told to stop.\n",
      "matches_git_head": true
    },
    "codegraph": {
      "exists": true,
      "path": "/mnt/ssd-SATARAID5/harry/projects/cfd_agentic_benchmark/cfd_solver_benchmark_workspace_template/workspace/oc-goal/kimik3-dsv4/04/.codegraph"
    },
    "benchmark_submodule": {
      "path": "/mnt/ssd-SATARAID5/harry/projects/cfd_agentic_benchmark/cfd_solver_benchmark_workspace_template/workspace/oc-goal/kimik3-dsv4/04/cfd_solver_agentic_benchmark",
      "exists": true,
      "commit": "1bc6580b84825037bbeac097ede1b2226d8185d1",
      "branch": "HEAD",
      "dirty": false,
      "origin_url": "https://github.com/harryzhou2000/cfd_solver_agentic_benchmark"
    }
  },
  "session_window": {
    "started_at": "2026-08-13T15:56:19.059000+00:00",
    "ended_at": "2026-08-13T23:22:42.395000+00:00",
    "activity_time_seconds": 23352.2,
    "idle_time_seconds": 3430.3,
    "idle_gap_threshold_seconds": 600
  },
  "questions": [],
  "user_answers": {},
  "status": "complete",
  "provenance": {
    "opencode_db": "/mnt/ssd-SATARAID5/harry/projects/cfd_agentic_benchmark/cfd_solver_benchmark_workspace_template/workspace/oc-goal/kimik3-dsv4/04/.sessions/opencode-data/opencode/opencode.db",
    "opencode_config_dir": "/mnt/ssd-SATARAID5/harry/projects/cfd_agentic_benchmark/cfd_solver_benchmark_workspace_template/workspace/oc-goal/kimik3-dsv4/04/.sessions/opencode-config",
    "generated_at": "2026-08-15T03:13:34.655159+00:00",
    "num_sessions": 1,
    "selected_roots": [
      "ses_004294f0cffe1r1FQyzhLt47Ym"
    ],
    "host_workspace": "/mnt/ssd-SATARAID5/harry/projects/cfd_agentic_benchmark/cfd_solver_benchmark_workspace_template/workspace/oc-goal/kimik3-dsv4/04",
    "recorded_directories": [
      "/workspace"
    ]
  }
}
